{"facts_version":1,"producer":{"name":"extract-postgres-schema","version":"0.1.0"},"tables":[{"id":"public.customers","schema":"public","name":"customers","columns":[{"name":"id","type":"bigint","nullable":false,"default":"nextval('customers_id_seq'::regclass)"},{"name":"email","type":"citext","nullable":false}],"constraints":[{"name":"customers_pkey","kind":"primary_key","definition":"PRIMARY KEY (id)"}],"indexes":["customers_email_index","customers_pkey"]},{"id":"public.order_totals","schema":"public","name":"order_totals","columns":[{"name":"customer_id","type":"bigint","nullable":true},{"name":"total_cents","type":"bigint","nullable":true}],"constraints":[],"indexes":[]},{"id":"public.orders","schema":"public","name":"orders","columns":[{"name":"id","type":"bigint","nullable":false},{"name":"customer_id","type":"bigint","nullable":false},{"name":"region_id","type":"integer","nullable":true},{"name":"total_cents","type":"integer","nullable":false,"default":"0"}],"constraints":[{"name":"orders_customer_id_fkey","kind":"foreign_key","definition":"FOREIGN KEY (customer_id) REFERENCES customers(id)"},{"name":"orders_pkey","kind":"primary_key","definition":"PRIMARY KEY (id)"},{"name":"orders_region_id_fkey","kind":"foreign_key","definition":"FOREIGN KEY (region_id) REFERENCES geo.regions(id)"},{"name":"orders_total_cents_check","kind":"check","definition":"CHECK ((total_cents >= 0))"}],"indexes":["orders_pkey"]}],"foreign_keys":[{"name":"orders_customer_id_fkey","from_table":"public.orders","from_columns":["customer_id"],"to_table":"public.customers","to_columns":["id"]}],"notes":[{"kind":"uncaptured_foreign_key_target","message":"orders_region_id_fkey: public.orders references geo.regions, which is outside the captured schemas"}]}
